Author;Date;Content
Xanrox;27-Aug;"Ethereum shows major weakness for the whole crypto market and altcoins. We can clearly see a descending triangle, and the price is below its resistance. This is not bullish. Bitcoin is approaching the main trendline of this uptrend. We also have a FVG (Fair Value GAP), but to me, this gap looks like an exhaustion gap, not a breakaway gap. This is very bearish.
Xanrox;28-Aug;The crash is very strong, and September didn't even start (we will see more downside later).
Xanrox;29-Aug;A lot of people got liquidated during this dump, but we will see more liquidation soon! I don't want to even see altcoins. I was really confident about this crash, as every time I see moonboys in the comment section, I need to enter a short position. Monthly candles: On Bitcoin, we have the lowest close since February! This is bearish.
EXCAVO;29-Aug;After the last fall, you entered the zone of interest. Now, we are likely to go to the white box, from which we will see the final movement down and the subsequent impulse with the renewal of new tops or without dipping into the zone of 54-56k. I look at the market extremely positively. -Because everything is down right now - Altcoins -We've held the Bitcoin level. -In a few days, it's September. -Markets rise on fear.
TradingShot;28-Aug;Bitcoin (BTCUSD) is taking a hit on a weekly basis as, despite last week's green candle that extended the rebound on the 1W MA50 (blue trend-line) and hyped hopes for a new 70k test, the last two days are resetting the momentum. Still, there is no cause for alarm as BTC has been practically consolidating since the March All Time High (ATH). And in fact, the market is no stranger to such consolidations as just as recently as last year, it was also ranged from March until October 2023, before starting the massive rally that led to the ATH. Even in the previous Cycle, we can somewhat see a rough consolidation pattern, which if it weren't for the COVID crash 'anomaly' of February 2020, the market would again be ranged from March to October 2020. As a side-note, check also how similar the 1W RSI sequences of those fractals are, trading around the same price levels as well. For title catchers, we can call this 'The March - October effect' and if it plays out again the exact same way it has historically, then as soon as September ends, we can be expecting one of Bitcoin's brutal Bull Cycle rallies (green Channels). Practically we are only a month away and as you can see in the previous Bull Cycle, the main two rallies have been fairly symmetric. If the one that might start in October is proportionally as strong as the October 2023 - February 2024 one, we might be looking for at least a $150000 Target.
Prefabsprout;27-Aug;If it weren't for the deadly bearish monthly chart this would look like too obvious a short set up. Curious to see if they drag it up to the top of the pennant again, or if it breaks down from here…
Prefabsprout;29-Aug;an inside bar would more likely mean a retest of the top of the pennant in my mind. so further slippage below 58 this week is called for if we want to maintain a bearish narrative. very curious to see how this plays out going into the new month.
The_ForexX_Mindset;28-Aug;Spent 7-plus hours connecting a strategy from a 5 candlestick countdown from a false breakout rocket signal. This means after a total of 5 candlesticks, BULLISH MOMENTUM begins. We might have our next 4-day timeframe 5 candlesticks as a downtrend, if so, then BULL RUN reads to start on 9/13 after a downtrend up to $56,761 or remain within its price range. Don't let this price scare you. It's only an estimate. Who am I to predict $56,761? but be ready to accept whatever comes our way within this current 4D TF candle and the other two candlesticks which will print out after this current candle. 5 candlesticks downtrend has been rejected in the past, if so, then BULL RUN is to start at any moment from 8/28/24 moving forward. This strategy requires waiting for confirmation. This strategy requires waiting for confirmation. Some of you would not have to wait for confirmation because you entered at the entry signal of 49K. Histogram trendlines are to confirm BULL CONFIRMATIONS but trendlines can be best used never alone but with my 5 candlestick countdown signal. I can't explain it all but I made it look easy to understand without reading. The picture chart says it all.This strategy is new to me. I had to get creative. I marked it as short but in reality, it's long.
The_ForexX_Mindset;29-Aug;We’ve waited long enough. This false breakout to the downside is to be confirmed by a total of 5 candles as a BEAR TRAP then moves up. We’ve seen how the trend moved up then the rally failed. 1. We wait for all total of 5 candles to close. 2. Or the false breakout downtrend may end within this currant candle 4D TF and make its way up. As I’ve been studying this FALSE breakout, I’ve seen many of these get rejected and move up. I did mention to a trader, if this was to happen then the body of the current candle must be above the body of the previous candle to then disregard the false breakout BEAR TRAP otherwise we wait. Normal in situations like this some traders sell but we’ve been confirmed something big is coming our way.
weslad;28-Aug;Bitcoin took a significant hit yesterday, dropping past our initial target zone and finding support at the secondary zone outlined in Plan B. The purpose of our plan is to identify key levels or zones that serve as strong areas for potential trades. If the Plan B level continues to hold, the price may form a potential leading diagonal, creating a wave structure from 1-5 as highlighted on the chart. This scenario could push BTC's next target back to the 66k-68k range. This setup allows us to use a tight stop loss just below 56k. It's a volatile market, so we should be prepared for any outcome. Trade safely.
weslad;29-Aug;Price going smoothly as expected, we may have first stop at 62k area, we should keep a close watch on this zone.
weslad;24-Aug;Hello everyone, This post highlights a series of technical patterns, all converging towards the same target area on Bitcoin. We’ve identified a descending broadening wedge, a cup and handle formation, and another descending broadening formation. The alignment of these patterns reinforces our bullish bias on Bitcoin, suggesting that a major upside move is imminent. We believe the potential for a significant rally is stronger now than ever. Please share your comments and thoughts on this analysis.
weslad;27-Aug;Price may be going down to give good buy back opportunity for those that still want to join the trade. We are anticipating the current pullback to initiate a move towards 68k/70k area before next correction. BTC is bullish and the trend is Bullish never Bearish.
AlanSantana;29-Aug;"We have two major lows to consider on this chart; STPTBTC. The first one happened September 2019 at 72 sats (0.00000072). Immediately after this low was hit, a bullish wave develop and totaled 789% growth. Nice, The second one is the ATL (All-Time Low), happened January 2021 at 41 sats (0.00000041). Immediately after this low was hit, a bullish wave developed and totaled 1,318% growth. Great! Now, we have a new major low and this is a long-term higher low, this happened June 2024 at 55 sats (0.00000055). We have two months of consolidation and there is potential for a new bullish wave. Total growth potential can hit between 557% and 933%. It can go higher as well but this is something that we have to wait to see how it all develops."
AlanSantana;28-Aug;My dear friends, I think you will like this one. I like this pair because we have been successful with it in the past and the chart looks good. There is one signal that is most important above all. We know the Crypto-market has been bearish, for a while now, and many altcoins have been hitting new lows all across. SafePal, on its Bitcoin pairing, SFPBTC, hit bottom March 2024... That's the signal. While there was a crash in early August, while there have seen swings, shakeouts and all that, this pair has been consolidating steadily, bullishly and this type of bullish consolidation tends to lead to massive growth.
Richtv_official;28-Aug;Recent Market Activity: Last night, Bitcoin experienced a sell-off, dropping to the next support level after attempting to reclaim both the Daily 200 Moving Average (MA) and the $64,000 resistance level at the end of last week. Key Levels: Daily 200 MA: A reclaim of this level would have been very bullish, but the drop below it in the last two days indicates that the bulls are not ready to push higher. Resistance at $64,000: BTC’s failure to reclaim this level signals continued weakness. Bearish Signals: With this being the second lower high on the Daily time frame since June, Bitcoin is clearly indicating that it is not yet ready to move higher.
paul_endeo;28-Aug;BTC had been in an upward trajectory as the previous week drew to a close, rising by 3.50% on Wednesday before a slight drop on Thursday as the 50-day SMA came into play, allowing sellers to push BTC down by just over 1%. However, bulls took control on Friday, with BTC registering an increase of 5.97%, pushing above the 50- and 200-day SMAs to settle at $64,032. In fact, BTC reached a day high of $65,054, but sellers pushed the price back below $65,000, a level they were expected to defend vigorously. The weekend saw buyers and sellers struggle to take control, with BTC only managing a marginal increase on Saturday. Sunday saw buyers attempt another push towards $65,000 while sellers tried to drive the price below the 200-day SMA. However, neither could establish control, and BTC remained at $64,085. The current week began with BTC dipping below the 200-day SMA after a 1.85% drop as sellers tightened their grip on the market. As a result, BTC dropped to $62,903. Bearish sentiment intensified on Tuesday as markets crashed, with BTC dropping by 5.40% to slip below the 50 and 20-day SMAs and the $60,000 price level to $59,506. The current session sees BTC remain in the red, down by 0.50%, as sellers look to drive the price lower. With Tuesday’s reversal, sellers have established control in the market, with any move above $64,000 ruled out for the time being. With September historically being a difficult month for BTC, it could drop further should sellers remain in control. Buyers will attempt to regroup and reclaim the $60,000 level, which is crucial to resume a push back above the moving averages and move towards $64,000. Should sellers continue to dominate, BTC could drop to the $58,000 support level.
Lingrid;29-Aug;Ethereum is clearly in the accumulation phase, sitting just below the psychological level of 3000. Recently, the price hit a support level that was also tested back in February and subsequently bounced off it. Over the past three weeks, we've observed mostly sideways movement. When examining the weekly timeframe, it's evident that the market formed a long-tailed bar, indicating a liquidity grab below the February low. This suggests that there was strong buying interest after the dip. Given that the market has retested the recent low area and rebounded, I believe we can expect a gradual upward movement from here. My target is resistance zone around 2950.
